{
  "schemaVersion": "wrs-runtime-v1",
  "id": "5a-2026-09-21-7-5-introduction",
  "title": "5A · 7.5 Contractions · Introduction",
  "step": "7",
  "substep": "5",
  "focus": "introduction",
  "lessonPath": "full",
  "plannedParts": [
    1,
    2,
    3,
    4,
    5,
    6,
    7,
    8,
    9,
    10
  ],
  "planningContext": {
    "conceptsToWeave": "Contractions: combine two words, identify the omitted letter(s), and use the apostrophe to represent the missing letter(s). Keep singular/plural possessives for subsequent 7.5 lessons.",
    "troubleSpots": "5A entered 7.5 after all three students charted 15/15 on 7.4 on Sep 18. Cumulative needs remain: Alex needs long/short-vowel support and tch/dge review; Finn needs vowel identification, long/short-vowel support, and tch/dge review; Maya knows the tch/dge-after-short-vowel concept but does not always apply it automatically."
  },
  "sources": [
    {
      "id": "IM-7.5-152-168",
      "kind": "instructor-manual",
      "label": "Wilson Reading System Instructor Manual · Substep 7.5",
      "edition": "Fourth Edition",
      "locator": "Substep 7.5, printed pp. 152-168",
      "notes": "Controls 7.5 source sequence, contraction instruction, later possessive instruction, Parts 1-8 procedures, and the no-new-sounds/no-nonsense-charting boundaries.",
      "verification": "verified"
    },
    {
      "id": "DB4-7.5",
      "kind": "dictation-book",
      "label": "WRS Dictation Book Steps 7-12",
      "edition": "Fourth Edition",
      "locator": "Substep 7.5: HFW PDF p. 11 / printed p. 5; words PDF pp. 24-25 / printed pp. 18-19; phrases PDF p. 28 / printed p. 22; sentences PDF pp. 37-38 / printed pp. 31-32",
      "notes": "Controls current 7.5 High Frequency Words and Part 8 words, phrases, and sentences.",
      "verification": "verified"
    },
    {
      "id": "SR7-7.5",
      "kind": "student-reader",
      "label": "WRS Student Reader Seven",
      "edition": "Fourth Edition",
      "locator": "Substep 7.5 PDF pp. 136-159 / printed pp. 134-157; cumulative nonsense review from 7.1N PDF p. 15 / printed p. 13",
      "notes": "Controls 7.5 wordlists, sentence pages, controlled passages, and the verified prior-Substep 7.1N nonsense pool used only as cumulative Part 8 review.",
      "verification": "verified"
    },
    {
      "id": "SN7-12-7.5",
      "kind": "student-notebook",
      "label": "WRS Student Notebook 7-12 Answer Key",
      "edition": "Fourth Edition",
      "locator": "Possessive reference PDF p. 62 / printed p. 58; Contractions PDF p. 65 / printed p. 61",
      "notes": "Controls the 7.5 notebook references for contractions and possessives.",
      "verification": "verified"
    },
    {
      "id": "TEACHER-5A-2026-09-18",
      "kind": "teacher-selection",
      "label": "5A current instructional state",
      "locator": "Student Data Current Snapshot and Teacher live note 2026-09-18",
      "notes": "All three students charted 15/15 on 7.4 and the teacher explicitly advanced the group to 7.5 Introduction for the next week.",
      "verification": "verified"
    }
  ],
  "parts": [
    {
      "part": 1,
      "title": "Sounds Quick Drill",
      "sourceIds": [
        "IM-7.5-152-168",
        "TEACHER-5A-2026-09-18"
      ],
      "teacherDirections": [
        "Drill the listed cumulative vowel responses and the listed previously taught consonant/final-stable-syllable responses. Substep 7.5 introduces no new letter-sounds."
      ],
      "data": {
        "eligibleVowels": [
          "a-apple-/ă/",
          "a-apron-/ā/",
          "a-/ä/",
          "e-Ed-/ĕ/",
          "e-equal-/ē/",
          "i-itch-/ĭ/",
          "i-ice-/ī/",
          "o-octopus-/ŏ/",
          "o-open-/ō/",
          "u-up-/ŭ/",
          "u-uniform-/ū/"
        ],
        "vowels": [
          "a-apple-/ă/",
          "a-apron-/ā/",
          "a-/ä/",
          "e-Ed-/ĕ/",
          "e-equal-/ē/",
          "i-itch-/ĭ/",
          "i-ice-/ī/",
          "o-octopus-/ŏ/",
          "o-open-/ō/",
          "u-up-/ŭ/",
          "u-uniform-/ū/"
        ],
        "selectedReview": [
          "dge-fudge-/j/",
          "tch-catch-/ch/",
          "tion-vacation-/shən/",
          "sion-mansion-/shən/, sion-television-/zhən/"
        ],
        "newCardsRequiredAfterPart2": false,
        "newAfterInstruction": [],
        "quickDrill": [
          "a-apple-/ă/",
          "a-apron-/ā/",
          "a-/ä/",
          "e-Ed-/ĕ/",
          "e-equal-/ē/",
          "i-itch-/ĭ/",
          "i-ice-/ī/",
          "o-octopus-/ŏ/",
          "o-open-/ō/",
          "u-up-/ŭ/",
          "u-uniform-/ū/",
          "dge-fudge-/j/",
          "tch-catch-/ch/",
          "tion-vacation-/shən/",
          "sion-mansion-/shən/, sion-television-/zhən/"
        ]
      }
    },
    {
      "part": 2,
      "title": "Teach & Review Concepts for Reading",
      "sourceIds": [
        "IM-7.5-152-168",
        "SR7-7.5",
        "TEACHER-5A-2026-09-18"
      ],
      "teacherDirections": [
        "Read competition, notion, isolation, and illustrate first. Then teach the complete introductory 7.5 contraction sequence while keeping possessive nouns for subsequent lessons.",
        "Show that a contraction combines two words and that the apostrophe represents the missing letter or letters. Include the irregular contractions don't and won't and the source groups formed with am, are, is, will, would, have, and had."
      ],
      "data": {
        "conceptNotes": "A contraction is a shortened combination of two words. The apostrophe represents omitted letter(s). Contractions with not are taught first; don't and won't are irregular High Frequency Words. The source then extends contraction work to am, are, is, will, would, have, and had. Singular and plural possessives are subsequent 7.5 lessons and are not introduced in this first 7.5 lesson.",
        "previousSubstepWords": [
          "competition",
          "notion",
          "isolation",
          "illustrate"
        ],
        "reviewWords": [
          "competition",
          "notion",
          "isolation",
          "illustrate"
        ],
        "currentExamples": [
          "does not",
          "doesn't",
          "is not",
          "isn't",
          "can't",
          "couldn't",
          "don't",
          "won't",
          "I'm",
          "I'll",
          "I'd",
          "we're",
          "they've",
          "he's"
        ],
        "currentWords": [
          "doesn't",
          "isn't",
          "can't",
          "couldn't",
          "don't",
          "won't",
          "I'm",
          "I'll",
          "I'd",
          "we're",
          "they've",
          "he's"
        ],
        "teachingMoves": [
          "Read competition, notion, isolation, and illustrate accurately before new instruction.",
          "Build does not, then replace the missing o in not with an apostrophe to form doesn't; connect the two forms without changing meaning.",
          "Build is not and form isn't the same way; then read can't, couldn't, didn't, hasn't, haven't, shouldn't, wasn't, weren't, and aren't while naming the two whole words.",
          "Teach don't and won't as irregular contractions and High Frequency Words.",
          "Extend the same apostrophe principle to the source contraction groups with am, are, is, will, would, have, and had; keep possessive nouns for a later 7.5 lesson."
        ],
        "sourceSequenceComplete": true,
        "part2Presentation": {
          "version": 1,
          "focus": "introduction",
          "interactiveSteps": [
            {
              "kind": "step",
              "id": "7-4-review",
              "provenance": "source-paraphrase",
              "actionType": "TEACH_CARD",
              "displayType": "WRITTEN_WORD",
              "layout": "review-row",
              "teacherCue": "Read competition, notion, isolation, and illustrate accurately before new instruction.",
              "teacherDirections": [
                "Present competition, notion, isolation, and illustrate; use scooping only as needed."
              ],
              "objects": [
                {
                  "id": "r-competition",
                  "text": "competition",
                  "role": "word"
                },
                {
                  "id": "r-notion",
                  "text": "notion",
                  "role": "word"
                },
                {
                  "id": "r-isolation",
                  "text": "isolation",
                  "role": "word"
                },
                {
                  "id": "r-illustrate",
                  "text": "illustrate",
                  "role": "word"
                }
              ],
              "expectedStudentAction": "Read each 7.4 word accurately.",
              "teachingPoint": "Cumulative 7.4 review before the 7.5 contraction sequence.",
              "sourceRef": {
                "sourceIds": [
                  "SR7-7.5",
                  "TEACHER-5A-2026-09-18"
                ],
                "locator": "5A 7.4 charting history plus 7.4 controlled review pool"
              },
              "sourceSection": "introductory-and-ongoing"
            },
            {
              "kind": "step",
              "id": "does-not-doesnt",
              "provenance": "source-paraphrase",
              "actionType": "TEACH_CARD",
              "displayType": "WRITTEN_WORD",
              "layout": "review-row",
              "teacherCue": "Build does not, then form doesn't.",
              "teacherDirections": [
                "Present does and not, then cover the o in not with the apostrophe card and read doesn't."
              ],
              "objects": [
                {
                  "id": "does",
                  "text": "does",
                  "role": "word"
                },
                {
                  "id": "not",
                  "text": "not",